<?xml version="1.0"?>

<mesh_h2d xmlns:xsi="http://www.w3.org/2001/XMLSchema-instance"
       xsi:noNamespaceSchemaLocation="../../include/mesh/mesh_h2d_xml.xsd">

  <variables>
    <variable name="a" value="1.0" />
    <variable name="m_a" value="-1.0" />
		<variable name="b" value="0.70710678118654757" />		
  </variables>

  <vertices>
    <vertex x="0" y="-1.0" />
		<vertex x="1.0" y="-1.0" />
		<vertex x="-1.0" y="0" />
		<vertex x="0" y="0" />
		<vertex x="1.0" y="0" />
		<vertex x="-1.0" y="1.0" />
		<vertex x="0" y="1.0" />
		<vertex x="0.70710678118654757" y="0.70710678118654757" />
  </vertices>

  <elements>
		<triangle v1="3" v2="4" v3="7" marker="Copper" />
		<triangle v1="3" v2="7" v3="6" marker="Aluminum" />
    <quad v1="0" v2="1" v3="4" v4="3" marker="Copper" />
		<quad v1="2" v2="3" v3="6" v4="5" marker="Aluminum" />
  </elements>

  <boundaries>
    <boundary_edge v1="0" v2="1" marker="Bottom" />
		<boundary_edge v1="1" v2="4" marker="Outer" />
		<boundary_edge v1="3" v2="0" marker="Inner" />
		<boundary_edge v1="4" v2="7" marker="Outer" />
		<boundary_edge v1="7" v2="6" marker="Outer" />
		<boundary_edge v1="2" v2="3" marker="Inner" />
		<boundary_edge v1="6" v2="5" marker="Outer" />
		<boundary_edge v1="5" v2="2" marker="Left" />
	</boundaries>

  <curves>
    <curve v1="4" v2="7" angle="45" />
		<curve v1="7" v2="6" angle="45" />
  </curves>
</mesh_h2d>